<?xml version="1.0" encoding="UTF-8"?>
<!DOCTYPE erabiltzaileak SYSTEM "erabiltzaileak.dtd">
<erabiltzaileak>
<erabiltzaile><erabiltzailea>a</erabiltzailea><eposta>aelorza@ikasle.es</eposta><pasahitza>a</pasahitza></erabiltzaile><erabiltzaile><erabiltzailea>kljj</erabiltzailea><eposta>aelorza003@ikasle.es</eposta><pasahitza>a</pasahitza></erabiltzaile></erabiltzaileak>
